{
  "version": "v1",
  "created_at": "2026-07-20T00:00:00Z",
  "description": "80 hand-curated customer support emails across 4 categories with deliberate edge cases. All test cases are human-verified ground truth — none were LLM-generated.",
  "test_cases": [
    {
      "id": "TC-001",
      "input_email": "Hi support, I noticed a charge of $29.99 on my credit card from your company but I cancelled my subscription two weeks ago. Can you look into this and process a refund? My account email is sarah@email.com.",
      "expected_category": "billing",
      "expected_summary": "Customer reports being charged after cancelling their subscription and is requesting a refund.",
      "difficulty": "easy",
      "notes": "Straightforward billing refund request."
    },
    {
      "id": "TC-002",
      "input_email": "I upgraded from the Basic plan to the Pro plan yesterday but I'm still being charged the Basic rate. When will the new pricing take effect? I want to make sure I'm getting all the Pro features I'm paying for.",
      "expected_category": "billing",
      "expected_summary": "Customer inquires about when their plan upgrade pricing will take effect after upgrading from Basic to Pro.",
      "difficulty": "easy",
      "notes": "Plan upgrade billing inquiry."
    },
    {
      "id": "TC-003",
      "input_email": "Your invoice #INV-2026-4481 has an incorrect tax calculation. We're a tax-exempt organization (EIN: 12-3456789) and should not be charged sales tax. Please issue a corrected invoice and credit the $47.23 in tax back to our account.",
      "expected_category": "billing",
      "expected_summary": "Customer reports incorrect tax charges on their invoice due to their tax-exempt status and requests a corrected invoice with a credit.",
      "difficulty": "medium",
      "notes": "Specific invoice correction with tax-exempt status — tests detail extraction."
    },
    {
      "id": "TC-004",
      "input_email": "Can you explain what the 'platform fee' line item is on my latest bill? I don't remember agreeing to any platform fee when I signed up. If this is a new charge that was added, I'd like to understand what it covers before my next billing cycle.",
      "expected_category": "billing",
      "expected_summary": "Customer questions an unfamiliar platform fee on their bill and wants clarification before the next billing cycle.",
      "difficulty": "easy",
      "notes": "Billing inquiry about unknown charges."
    },
    {
      "id": "TC-005",
      "input_email": "We need to update our payment method from the Visa ending in 4242 to a corporate Amex card. Also, can you switch our billing cycle from monthly to annual? We'd like to take advantage of the annual discount you advertised.",
      "expected_category": "billing",
      "expected_summary": "Customer requests to update their payment method and switch from monthly to annual billing to receive the annual discount.",
      "difficulty": "easy",
      "notes": "Multi-part billing update request."
    },
    {
      "id": "TC-006",
      "input_email": "I'm disputing the overage charges on last month's bill. We were told our plan includes 10,000 API calls per month, but we were charged for overages at 8,500 calls. I have the original sales email confirming our quota. How do I submit this for review?",
      "expected_category": "billing",
      "expected_summary": "Customer disputes overage charges claiming their API usage was below their plan's quota and wants to submit evidence for review.",
      "difficulty": "medium",
      "notes": "Billing dispute with evidence reference — tests understanding of dispute context."
    },
    {
      "id": "TC-007",
      "input_email": "Hi, quick question — if I add 3 more team members to our Business plan, will we be prorated for the rest of the month or charged the full per-seat price immediately? Budget is tight this quarter so timing matters.",
      "expected_category": "billing",
      "expected_summary": "Customer asks about proration policy when adding team members to their Business plan due to budget constraints.",
      "difficulty": "easy",
      "notes": "Straightforward pricing inquiry."
    },
    {
      "id": "TC-008",
      "input_email": "URGENT: We were charged $2,499 instead of the agreed $249/month for our Enterprise contract. This appears to be a decimal error. Our CFO is asking questions. Please escalate this immediately and reverse the incorrect charge. Reference: Contract #ENT-2026-089.",
      "expected_category": "billing",
      "expected_summary": "Customer reports an urgent overcharge of 10x the contracted amount and demands immediate escalation and reversal.",
      "difficulty": "medium",
      "notes": "Urgent billing error with specific contract reference."
    },
    {
      "id": "TC-009",
      "input_email": "We're a nonprofit and wondering if you offer any discounted pricing. We have about 25 users and really love the product but our grant funding limits what we can spend on software tools. Is there a nonprofit program or educational discount we could apply for?",
      "expected_category": "billing",
      "expected_summary": "Customer inquires about nonprofit or educational discount programs for their 25-person organization.",
      "difficulty": "easy",
      "notes": "Pricing inquiry for special discount programs."
    },
    {
      "id": "TC-010",
      "input_email": "My annual subscription renews next week and I want to downgrade from Pro to Basic before that happens. If I downgrade now, will I lose access to Pro features immediately or will they remain until the renewal date? I don't want any surprises on my bill.",
      "expected_category": "billing",
      "expected_summary": "Customer wants to downgrade their plan before annual renewal and asks about the timing of feature access changes.",
      "difficulty": "easy",
      "notes": "Downgrade timing and billing cycle question."
    },
    {
      "id": "TC-011",
      "input_email": "For the past three months, our invoices have been sent to accounting@oldcompany.com but we merged with another firm. Please update the billing email to finance@newcorp.com. Also, our company name on the invoice should now read 'NewCorp Solutions LLC' for our records.",
      "expected_category": "billing",
      "expected_summary": "Customer requests updates to their billing email address and company name on invoices following a company merger.",
      "difficulty": "medium",
      "notes": "Could be confused with 'account' since it involves contact info, but the primary intent is invoice/billing updates."
    },
    {
      "id": "TC-012",
      "input_email": "I tried to pay my outstanding balance but your payment page keeps returning a 'transaction declined' error even though my card works fine everywhere else. I've tried two different cards and both fail. Can you check if there's an issue on your end?",
      "expected_category": "billing",
      "expected_summary": "Customer reports payment processing failures with multiple cards and suspects a system-side issue.",
      "difficulty": "medium",
      "notes": "Billing + technical overlap — but primary intent is making a payment, so billing."
    },
    {
      "id": "TC-013",
      "input_email": "Per our conversation last Thursday with your sales rep Marcus, we agreed on a custom enterprise rate of $8.50 per user per month for a 3-year commitment. I haven't received the formal quote yet. Can you send that over so our procurement team can process the PO?",
      "expected_category": "billing",
      "expected_summary": "Customer follows up on an agreed custom enterprise pricing quote that hasn't been received yet for procurement processing.",
      "difficulty": "easy",
      "notes": "Enterprise pricing follow-up."
    },
    {
      "id": "TC-014",
      "input_email": "Hola, necesito ayuda con mi factura. Me cobraron dos veces este mes — $19.99 on March 1 and again on March 15. I only have one subscription. Please refund the duplicate. Gracias.",
      "expected_category": "billing",
      "expected_summary": "Customer reports a duplicate charge in a bilingual email and requests a refund for the extra payment.",
      "difficulty": "hard",
      "notes": "Mixed Spanish/English email — tests language handling."
    },
    {
      "id": "TC-015",
      "input_email": "hiii so like i got charged?? for something i def did not buy lol. my bank shows $9.99 from u guys on june 5th but i thought i canceled ages ago??? can u plz check bc im broke rn thx",
      "expected_category": "billing",
      "expected_summary": "Customer reports an unexpected charge after believing they had previously cancelled and requests investigation.",
      "difficulty": "hard",
      "notes": "Informal writing style with slang, abbreviations, and no punctuation — tests robustness to casual tone."
    },
    {
      "id": "TC-016",
      "input_email": "Refund.",
      "expected_category": "billing",
      "expected_summary": "Customer requests a refund with no additional context provided.",
      "difficulty": "hard",
      "notes": "Extremely short email — tests handling of minimal input."
    },
    {
      "id": "TC-017",
      "input_email": "I want to cancel my subscription effective immediately. Don't charge me for next month. I also want a refund for the remaining days of this month since I won't be using the service. Please confirm in writing that my recurring payments have been stopped.",
      "expected_category": "billing",
      "expected_summary": "Customer demands immediate subscription cancellation with a prorated refund and written confirmation of payment cessation.",
      "difficulty": "medium",
      "notes": "Cancellation + refund + confirmation — multi-part billing request."
    },
    {
      "id": "TC-018",